{
  "calculationDay": {
    "jdn": "2461300"
  },
  "observer": {
    "longitude": 45.481
  },
  "locale": "en",
  "year": {
    "number": "5000",
    "lengthDays": 100,
    "startJdn": "2461300",
    "endJdn": "2461399",
    "cutlets": [
      {
        "canonicalIndex": 1,
        "name": "Bronze",
        "lengthDays": 100,
        "startOffset": 0,
        "endOffset": 99
      }
    ],
    "months": [
      {
        "canonicalIndex": 2,
        "name": "Pomegranate",
        "lengthDays": 20
      }
    ]
  }
}
